{
  "schema_version": "mesh-run-config-v0",
  "run_name": "fixture-smoke",
  "generator": {
    "name": "fixture",
    "version": "1"
  },
  "domain": {
    "name": "unit-square",
    "kind": "fixture"
  },
  "crs": "EPSG:3857",
  "coordinate_units": "m",
  "state_units": {
    "volume": "m3",
    "depth": "m"
  },
  "output_root": "../mesh_runs"
}
